{"inbox_id":"remote-session-runner-workspace","request_id":"req-bug024-20261016-sandbox-01","operation":"run","request_state":"complete","response_revision":2,"job_id":"job-55bc5839d5358e8fb17a690cf44f1661","job_phase":"complete","command_id":"cmd-16aa57086ba55eaf260ff0dc5ed0845d","session_id":"sess-faa3d688dad736e0815de1d45728c870","delivery_state":"reconciled","command_state":"succeeded","observed_at":"2026-10-16T09:03:56.145326232Z","exit_code":0,"stdout":"BUG024_WORKSPACE_SANDBOX_OK\nubuntu\nLinux\naarch64\noracle-gustaw-janecki-ubuntu-flex-02\n","final_event_sequence":5,"available_event_sequence":5,"output_complete":true,"output_truncated":false,"events_file":"events/cmd-16aa57086ba55eaf260ff0dc5ed0845d.ndjson","teardown_outcome":"closed","execution_selection_source":"request_override","resolved_environment":"sandbox-dev","resolved_execution_target":{"kind":"remote","profile":"sandbox-host"}}
