{"inbox_id":"remote-session-runner-workspace","request_id":"req-bug024-20261016-mac-01","operation":"run","request_state":"complete","response_revision":2,"job_id":"job-e0b3e498c18985a329d65c4be124da36","job_phase":"complete","command_id":"cmd-c7dc5c98c2fe41e998086eca10311add","session_id":"sess-581f66867ac4bde8fb96d273abdd2576","delivery_state":"accepted","command_state":"succeeded","observed_at":"2026-10-16T09:00:18.235496Z","exit_code":0,"stdout":"BUG024_WORKSPACE_MAC_OK\ntomasz.walczuk\nDarwin\narm64\nAMAK2KJ6X9JJJ\n","final_event_sequence":6,"available_event_sequence":6,"output_complete":true,"output_truncated":false,"events_file":"events/cmd-c7dc5c98c2fe41e998086eca10311add.ndjson","teardown_outcome":"closed","execution_selection_source":"inbox_default","resolved_environment":"mac-dev","resolved_execution_target":{"kind":"local","profile":"mac-workstation"}}
