{"inbox_id":"remote-session-runner-workspace","request_id":"req-bug024-20261016-factory-01","operation":"run","request_state":"complete","response_revision":2,"job_id":"job-f9ab3683d35830edac2a24837a2cc3ce","job_phase":"complete","command_id":"cmd-a80e9ad7f84b1d1d5bc3db8ee1fe695c","session_id":"sess-44a67113199d0047e2e1bcddd0d8689b","delivery_state":"reconciled","command_state":"succeeded","observed_at":"2026-10-16T09:04:56.912017183Z","exit_code":0,"stdout":"BUG024_WORKSPACE_FACTORY_OK\nubuntu\nLinux\nx86_64\noracle-waclaw-dziwulski-ubuntu-micro-01\n","final_event_sequence":5,"available_event_sequence":5,"output_complete":true,"output_truncated":false,"events_file":"events/cmd-a80e9ad7f84b1d1d5bc3db8ee1fe695c.ndjson","teardown_outcome":"closed","execution_selection_source":"request_override","resolved_environment":"factory-sandbox-dev","resolved_execution_target":{"kind":"remote","profile":"factory-sandbox"}}
