{"inbox_id":"remote-session-runner-workspace","request_id":"req-bug024-20261016-linux-01","operation":"run","request_state":"complete","response_revision":2,"job_id":"job-26521a288dba49c9717a75482904b7b6","job_phase":"complete","command_id":"cmd-af33f399ee0294d78c8cfe2ed1d3a57b","session_id":"sess-ff38cce48e95fc160c5171c766ab71dd","delivery_state":"reconciled","command_state":"succeeded","observed_at":"2026-10-16T09:02:42.917426643Z","exit_code":0,"stdout":"BUG024_WORKSPACE_LINUX_OK\nubuntu\nLinux\nx86_64\noracle-yuta-konopka-ubuntu-micro-02\n","final_event_sequence":5,"available_event_sequence":5,"output_complete":true,"output_truncated":false,"events_file":"events/cmd-af33f399ee0294d78c8cfe2ed1d3a57b.ndjson","teardown_outcome":"closed","execution_selection_source":"request_override","resolved_environment":"linux-dev","resolved_execution_target":{"kind":"remote","profile":"linux-host"}}
